{
  "meta": {
    "artifact_name": "planner_execution_plan",
    "artifact_version": "0.1.1",
    "brief_id": "brief_demo_action_camera_001",
    "workflow_version": "0.2.1-v2-planner-revised",
    "project_name": "E-commerce Growth Agent Studio",
    "project_name_cn": "电商增长 Agent 工作台",
    "producer": "Planner Agent",
    "step": 12,
    "status": "completed_revised",
    "confidence": 0.88,
    "created_at": "2026-07-15T17:42:00+08:00",
    "language": "zh-CN",
    "revised_at": "2026-07-15T19:12:00+08:00",
    "revision_note": "Step 12 revised in place to align with E-commerce Growth Agent Studio V2 positioning and product naming constraints."
  },
  "planner_scope": {
    "responsibility_boundary": [
      "Convert the standardized Brief and upstream structured artifacts into an executable V2 workflow plan.",
      "Define task decomposition, node routing, node input/output contracts, risk routing, human approval fields, evaluation targets, and downstream handoff fields.",
      "Preserve existing compliance gates and blocked final generation states."
    ],
    "not_responsible_for": [
      "final marketing copy",
      "final image prompt",
      "image generation",
      "frontend page",
      "public release assets",
      "rerunning steps 1-11",
      "executing Human Approval Node",
      "executing Growth Evaluation Agent"
    ],
    "positioning_guardrail": "This is a ToB Agent Workflow / Skills product for enterprise ecommerce teams. The demo product is 运动相机 in a smart imaging device launch scenario, not a single-brand, single-model, or single-product tool. Image-quality parameters require source evidence and review."
  },
  "source_files": {
    "read_successfully": [
      "PROJECT_MEMORY_FOR_OPENCLAW.md",
      "workflow/agent_workflow.md",
      "workflow/agent_io_contracts.md",
      "outputs/standardized_brief_summary.json",
      "outputs/audience_insight.json",
      "outputs/selling_point_matrix.json",
      "outputs/platform_strategy_plan.json",
      "outputs/creative_copy_pack_outline.json",
      "outputs/image_prompt_pack_outline.json",
      "outputs/brand_compliance_report.json",
      "outputs/growth_metrics_plan.json",
      "outputs/final_creative_package_report.json",
      "FILE_INDEX.md"
    ],
    "missing_in_current_workspace": [
      "README.md",
      "docs/clickable_file_index.md",
      "docs/steps_01_to_11_content_index.md",
      "docs/workflow_diagram.md",
      "docs/evaluation_metrics_test_plan.md",
      "docs/enterprise_governance_design.md"
    ],
    "missing_file_handling": "Missing optional portfolio navigation files were recorded where applicable and do not block Step 12. This revision used only active workspace files."
  },
  "inherited_context": {
    "completed_steps": [
      "Brief Parser",
      "Audience Insight",
      "Selling Point Analyst",
      "Platform Strategy",
      "Creative Copy Outline",
      "Image Prompt Outline",
      "Brand Compliance",
      "Growth Metrics",
      "Creative Package Reporter"
    ],
    "v2_nodes_added": [
      "Planner Agent",
      "Human Approval Node",
      "Growth Evaluation Agent"
    ],
    "compliance_inheritance": {
      "final_marketing_copy": "blocked",
      "final_image_prompt": "blocked",
      "image_generation": "blocked",
      "public_release": "blocked",
      "allowed_current_action": "structured planning artifacts only"
    },
    "demo_context": {
      "industry": "智能影像设备",
      "scenario_type": "新品上市营销工作流",
      "demo_product": "运动相机",
      "target_regions": [
        "中国大陆"
      ],
      "channels": [
        "抖音",
        "小红书",
        "天猫",
        "京东"
      ],
      "product_naming_rule": "Use 运动相机 as the only demo product name. Do not use parameter-prefixed product names, specific brand names, or specific model names.",
      "parameter_review_rule": "HD and panorama parameters require source evidence and proof review; without evidence they must be needs_review or blocked."
    }
  },
  "workflow_routing": {
    "v2_route_summary": [
      "Brief Parser normalizes and validates the input brief.",
      "Planner Agent creates the governed V2 execution plan before downstream orchestration.",
      "Audience Insight, Selling Point Analyst, and Platform Strategy may run in parallel after the standardized Brief is available.",
      "Creative Agent waits for Audience Insight, Selling Point Analyst, and Platform Strategy outputs to be completed and summarized.",
      "Brand Compliance must run before Human Approval.",
      "Human Approval records approved, needs_revision, or blocked before Image Prompt Skill proceeds.",
      "Image Prompt Skill remains a single node and must run after Human Approval in the V2 workflow.",
      "Growth Evaluation Agent reads both compliance conclusions and human approval results before evaluation.",
      "Final Report Generator summarizes the complete execution record and governed artifact index."
    ],
    "routing_rules": [
      {
        "rule_id": "route_parallel_analysis_after_brief",
        "description": "Audience Insight, Selling Point Analyst, and Platform Strategy can execute in parallel after standardized_brief_summary is available.",
        "upstream_required": [
          "outputs/standardized_brief_summary.json"
        ],
        "parallel_nodes": [
          "Audience Insight Skill",
          "Selling Point Analyst Agent",
          "Platform Strategy Skill"
        ]
      },
      {
        "rule_id": "route_creative_waits_for_analysis",
        "description": "Creative Agent must wait for the three analysis outputs to be summarized before creating creative module structures.",
        "upstream_required": [
          "outputs/audience_insight.json",
          "outputs/selling_point_matrix.json",
          "outputs/platform_strategy_plan.json"
        ],
        "downstream_node": "Creative Agent"
      },
      {
        "rule_id": "route_compliance_before_approval",
        "description": "Brand Compliance must evaluate structured creative and visual planning risks before Human Approval.",
        "upstream_required": [
          "outputs/creative_copy_pack_outline.json",
          "outputs/image_prompt_pack_outline.json"
        ],
        "downstream_node": "Human Approval Node"
      },
      {
        "rule_id": "route_image_prompt_after_approval",
        "description": "Image Prompt Skill must remain a single node and may only proceed after Human Approval records approved, needs_revision, or blocked in the V2 governed route.",
        "upstream_required": [
          "outputs/brand_compliance_report.json",
          "future_outputs/human_approval_result.json"
        ],
        "downstream_node": "Image Prompt Skill"
      },
      {
        "rule_id": "route_growth_evaluation_after_compliance_and_approval",
        "description": "Growth Evaluation Agent must use compliance status and approval decisions before scoring workflow performance.",
        "upstream_required": [
          "outputs/brand_compliance_report.json",
          "future_outputs/human_approval_result.json"
        ],
        "downstream_node": "Growth Evaluation Agent"
      }
    ],
    "v2_workflow_sequence": [
      "Brief Parser Agent",
      "Planner Agent",
      "Audience Insight Skill / Selling Point Analyst Agent / Platform Strategy Skill",
      "Creative Agent",
      "Brand Compliance Agent",
      "Human Approval Node",
      "Image Prompt Skill",
      "Growth Evaluation Agent",
      "Final Report Generator"
    ]
  },
  "node_execution_plan": [
    {
      "node": "Brief Parser Agent",
      "task_stage": "input parsing",
      "read_files": [
        "sample_brief.json",
        "schemas/product_brief.schema.json"
      ],
      "expected_output": "outputs/standardized_brief_summary.json",
      "hands_off_to": [
        "Audience Insight Skill",
        "Selling Point Analyst Agent",
        "Platform Strategy Skill",
        "Brand Compliance Agent"
      ],
      "status_rule": "Stop workflow if required fields are missing or schema validation fails."
    },
    {
      "node": "Audience Insight Skill",
      "task_stage": "user insight",
      "read_files": [
        "outputs/standardized_brief_summary.json",
        "sample_brief.json"
      ],
      "expected_output": "outputs/audience_insight.json",
      "hands_off_to": [
        "Creative Copy Agent",
        "Image Prompt Skill",
        "Growth Evaluation Agent",
        "Final Report Generator"
      ],
      "status_rule": "Mark assumptions and low-confidence insights for review."
    },
    {
      "node": "Selling Point Analyst Agent",
      "task_stage": "selling point analysis",
      "read_files": [
        "outputs/standardized_brief_summary.json",
        "outputs/audience_insight.json",
        "sample_brief.json"
      ],
      "expected_output": "outputs/selling_point_matrix.json",
      "hands_off_to": [
        "Creative Copy Agent",
        "Brand Compliance Agent",
        "Human Approval Node",
        "Final Report Generator"
      ],
      "status_rule": "Any claim without proof must be tagged as needs_review or blocked for final generation."
    },
    {
      "node": "Platform Strategy Skill",
      "task_stage": "platform strategy",
      "read_files": [
        "outputs/standardized_brief_summary.json",
        "outputs/audience_insight.json",
        "outputs/selling_point_matrix.json"
      ],
      "expected_output": "outputs/platform_strategy_plan.json",
      "hands_off_to": [
        "Creative Copy Agent",
        "Image Prompt Skill",
        "Growth Evaluation Agent",
        "Final Report Generator"
      ],
      "status_rule": "KPI language must remain observational and may not become commercial outcome promises."
    },
    {
      "node": "Creative Copy Agent",
      "task_stage": "creative structure",
      "read_files": [
        "outputs/audience_insight.json",
        "outputs/selling_point_matrix.json",